{
  "$schema": "http://json-schema.org/draft-07/schema#",
  "$id": "meta_social_asset",
  "title": "Meta Social Asset",
  "description": "Platform-independent social publishing asset produced by module 11 (daily) or module 10-intraday (story). Carries the shared AI output plus per-platform formatted payloads ready for the Meta publish step. Passed to module 12 (daily) or the intraday story delivery module.",
  "type": "object",
  "required": [
    "topic_slug",
    "date_key",
    "asset_type",
    "source_type",
    "ai_output",
    "instagram",
    "facebook",
    "generated_at"
  ],
  "properties": {
    "topic_slug": {
      "type": "string",
      "pattern": "^[a-z][a-z0-9_-]*$",
      "description": "Topic slug. Matches the topic the content was generated for."
    },
    "date_key": {
      "type": "string",
      "pattern": "^\\d{4}-\\d{2}-\\d{2}$",
      "description": "Date the content relates to (YYYY-MM-DD)."
    },
    "asset_type": {
      "type": "string",
      "enum": ["daily_post", "story"],
      "description": "Whether this is a feed-style daily post or a story-style asset."
    },
    "source_type": {
      "type": "string",
      "enum": ["daily_summary", "alert"],
      "description": "What source triggered this asset: a completed daily summary or a high-priority intraday alert."
    },
    "source_id": {
      "type": ["string", "null"],
      "description": "For alert-sourced assets: the item_id of the originating alert. For daily_summary assets: null or 'daily'."
    },
    "publish_job_id": {
      "type": ["integer", "null"],
      "description": "D1 publish_jobs row ID for daily_summary-sourced assets. Null for alert-sourced assets."
    },
    "ai_output": {
      "type": "object",
      "description": "Raw validated AI output from the meta_social_post schema.",
      "$ref": "../../../schemas/ai/meta_social_post.json"
    },
    "instagram": {
      "type": "object",
      "required": ["enabled", "caption"],
      "properties": {
        "enabled": {
          "type": "boolean",
          "description": "Whether Instagram publishing is enabled for this asset."
        },
        "caption": {
          "type": "string",
          "maxLength": 2200,
          "description": "Instagram-formatted caption. Truncated to 2200 characters with hashtags appended. Derived from ai_output.post_caption."
        },
        "story_caption": {
          "type": ["string", "null"],
          "maxLength": 200,
          "description": "Instagram story caption. Null when stories are disabled or not supported for this asset_type."
        },
        "story_enabled": {
          "type": "boolean",
          "description": "Whether Instagram story publishing is enabled for this asset."
        }
      },
      "additionalProperties": false,
      "description": "Instagram-specific formatted payload."
    },
    "facebook": {
      "type": "object",
      "required": ["enabled", "caption"],
      "properties": {
        "enabled": {
          "type": "boolean",
          "description": "Whether Facebook publishing is enabled for this asset."
        },
        "caption": {
          "type": "string",
          "maxLength": 63206,
          "description": "Facebook-formatted caption. Hashtags appended. May be slightly longer than Instagram caption. Derived from ai_output.post_caption."
        },
        "story_caption": {
          "type": ["string", "null"],
          "maxLength": 200,
          "description": "Facebook story caption. Null when stories are disabled or not supported for this asset_type."
        },
        "story_enabled": {
          "type": "boolean",
          "description": "Whether Facebook story publishing is enabled for this asset."
        }
      },
      "additionalProperties": false,
      "description": "Facebook-specific formatted payload."
    },
    "generated_at": {
      "type": "string",
      "format": "date-time",
      "description": "ISO-8601 UTC timestamp when this asset was generated."
    }
  },
  "additionalProperties": false,
  "examples": [
    {
      "topic_slug": "crypto",
      "date_key": "2025-01-15",
      "asset_type": "daily_post",
      "source_type": "daily_summary",
      "source_id": null,
      "publish_job_id": 42,
      "ai_output": {
        "post_caption": "Bitcoin ETF inflows hit a record $500M in a single session as institutional demand accelerates.",
        "hashtags": ["#crypto", "#bitcoin", "#BTC", "#ETF"],
        "image_prompt": "Professional financial chart with Bitcoin price rally",
        "story_caption": "BTC ETFs record $500M single-day inflows 🚀",
        "story_background_hint": "Dark gradient with orange Bitcoin symbol",
        "cta": "Full daily crypto briefing — link in bio."
      },
      "instagram": {
        "enabled": true,
        "caption": "Bitcoin ETF inflows hit a record $500M in a single session as institutional demand accelerates.\n\nFull daily crypto briefing — link in bio.\n\n#crypto #bitcoin #BTC #ETF",
        "story_caption": "BTC ETFs record $500M single-day inflows 🚀",
        "story_enabled": false
      },
      "facebook": {
        "enabled": true,
        "caption": "Bitcoin ETF inflows hit a record $500M in a single session as institutional demand accelerates.\n\nFull daily crypto briefing — link in bio.\n\n#crypto #bitcoin #BTC #ETF",
        "story_caption": "BTC ETFs record $500M single-day inflows 🚀",
        "story_enabled": false
      },
      "generated_at": "2025-01-15T23:45:00Z"
    }
  ]
}
